{
  "schema_version": 1,
  "unitid": "100003",
  "scrape_year": 2026,
  "status": "published",
  "source_url": "https://gamma.edu/reports/chtr-2025-scanned.pdf",
  "documents": [
    "c79d222cc902b903d5a6518581e881068acdf242b7ae7ac8e4b0fa9ce31307cf",
    "3e34e084dc0a046f436d27cd5aff22947d36e2fd0bd78ced73040ffd0e0cf8d6"
  ],
  "fetched_at": "2026-02-01T14:10:00Z"
}
